Project Name,Project Type,Price,Description,Map URL
"دابوق","فلل فخمة 500م","850,000 دينار","تشطيب حصري وراقي في أرقى أحياء عمّان مع مسابح خاصة","https://www.google.com/maps/embed?pb=!1m18!1m12!1m3!1d13538.52042145!2d35.8118012!3d31.9701018!2m3!1f0!2f0!3f0!3m2!1i1024!2i768!4f13.1!3m3!1m2!1s0x151ca11aaef838b9%3A0x9bbd8b52eb4bff8!2sDabouq%2C%20Amman!5e0!3m2!1sen!2sjo!4v1700000000000"
"فيكتوريا","فلل مستقلة ومزارع","260,000 دينار","كمباوند راقٍ على طريق المطار بخصوصية تامة ومساحات خضراء","https://www.google.com/maps/embed?pb=!1m18!1m12!1m3!1d13554.498425121406!2d35.9149021!3d31.8624177!2m3!1f0!2f0!3f0!3m2!1i1024!2i768!4f13.1!3m3!1m2!1s0x151ca79e4d588fa7%3A0x60f06bfefbf89be8!2sQueen%20Alia%20International%20Airport%20Road!5e0!3m2!1sen!2sjo!4v1700000000000"
"ياسمينا ريزدنس","قطع أراضي وفلل","84,000 دينار","أكبر مشروع في الأردن، 275 فيلا، أقساط 48 شهر بدون فوائد",""
"المفرق","فلل وشقق تجارية","48,000 دينار","فرصة استثمارية كبيرة بأسعار تنافسية وعوائد إيجارية مجزية",""
"المشاريع الدولية","مشاريع خارج الأردن","متنوعة","استثمارات ناجحة في تركيا وعدة دول خارج الأردن",""
"المشاريع التجارية","مكاتب ومعارض","تواصل للأسعار","مراكز تجارية استراتيجية ومكاتب عصرية بمواقع حيوية",""
